<!ELEMENT Kurs (Fach, Typ, Stufe, Bezeichner, Unterricht, Lehrer, Sch端ler*)>
<!ELEMENT Fach (#PCDATA)>
<!ELEMENT Typ (#PCDATA)>
<!ELEMENT Stufe (#PCDATA)>
<!ELEMENT Bezeichner (#PCDATA)>
<!ELEMENT Unterricht (Einheit+)>
<!ELEMENT Einheit (Tag, Stunde, Raum?)>
<!ELEMENT Tag (#PCDATA)>
<!ELEMENT Stunde (#PCDATA)>
<!ELEMENT Raum (#PCDATA)>
<!ELEMENT Lehrer (Name, Vorname)>
<!ATTLIST Lehrer
  k端rzel CDATA #REQUIRED
  geschlecht CDATA #REQUIRED
> 
<!ELEMENT Name (#PCDATA)>
<!ELEMENT Vorname (#PCDATA)>
<!ELEMENT Sch端ler (Name, Vorname, Kurssprecher?)>
<!ATTLIST Sch端ler
  geschlecht CDATA #REQUIRED
>
<!ELEMENT Kurssprecher EMPTY>