<?xml version="1.0" encoding="iso-8859-1"?>
<!DOCTYPE Kurs SYSTEM "kurs.dtd">
<Kurs>
  <!-- Organisation -->
  <Fach>Bildende Kunst</Fach>
  <Typ>Grundkurs</Typ>
  <Stufe>11</Stufe>
  <Bezeichner>11-bk-1</Bezeichner>
  <Unterricht>
    <Einheit>
        <Tag>Mittwoch</Tag>
        <Stunde>3</Stunde>
	    <Raum>M41</Raum>
    </Einheit>
    <Einheit>
        <Tag>Mittwoch</Tag>
        <Stunde>3</Stunde>
        <Raum>M41</Raum>
    </Einheit>
    <Einheit>
	    <Tag>Mittwoch</Tag>
        <Stunde>3</Stunde>
        <Raum>M41</Raum>
    </Einheit>
  </Unterricht>
  <!-- Personen -->
  <Lehrer kürzel="SW" geschlecht="m">
    <Name>Schmitt</Name>
	<Vorname>Peter</Vorname>
  </Lehrer>
  <Schüler geschlecht="m">
    <Name>Beyer</Name>
	<Vorname>Alexander</Vorname>
  </Schüler>
  <Schüler geschlecht="w">
    <Name>Baum</Name>
	<Vorname>Nina</Vorname>
    <Kurssprecher/>
  </Schüler>
  <Schüler geschlecht="w">
    <Name>Müller</Name>
	<Vorname>Katrin</Vorname>
  </Schüler>
  <Schüler geschlecht="m">
    <Name>Dinc</Name>
	<Vorname>Yunus</Vorname>
  </Schüler>
  <!-- ... -->
</Kurs>