<?xml version="1.0" encoding="iso-8859-1"?>
<!DOCTYPE Kurs SYSTEM "kurs.dtd">
<Kurs>
  <!-- Organisation -->
  <Fach>Informatik</Fach>
  <Typ>Grundkurs</Typ>
  <Stufe>11</Stufe>
  <Bezeichner>11-inf-1</Bezeichner>
  <Unterricht>
    <Einheit>
      <Tag>Montag</Tag>
	  <Stunde>7</Stunde>
	  <Raum>B04</Raum>
    </Einheit>
    <Einheit>
      <Tag>Mittwoch</Tag>
	  <Stunde>3</Stunde>
    </Einheit>
    <Einheit>
      <Tag>Mittwoch</Tag>
	  <Stunde>4</Stunde>
    </Einheit>
  </Unterricht>
  <!-- Personen -->
  <Lehrer kürzel="SU" geschlecht="w">
    <Name>Schuster</Name>
	<Vorname>Christiane</Vorname>
  </Lehrer>
  <Schüler geschlecht="m">
    <Name>Schwarz</Name>
	<Vorname>Tobias</Vorname>
  </Schüler>
  <Schüler geschlecht="w">
    <Name>Baum</Name>
	<Vorname>Nina</Vorname>
  </Schüler>
  <Schüler geschlecht="w">
    <Name>Müller</Name>
	<Vorname>Katrin</Vorname>
	<Kurssprecher/>
  </Schüler>
  <Schüler geschlecht="m">
    <Name>Roth</Name>
	<Vorname>Andreas</Vorname>
  </Schüler>
  <!-- ... -->
</Kurs>